{"contract_version":"0.1.0","run_id":"adl-g2-20260831","generation":2,"threshold":0.017831,"prevalence":0.01052,"misses":[{"instance_id":"I000713","vector_id":"V013","chain":["open_mule_account","drain_single","layer_through_mules","cross_channel_hop"],"primitives_present":["open_mule_account","drain_single","layer_through_mules","cross_channel_hop"],"score":0.00373,"level_scores":{"transaction":null,"session":null,"graph":null},"top_shap":[{"feature":"g_degree_ratio","value":3.9167},{"feature":"acct_txn_count_24h","value":1.3093},{"feature":"hour_of_day","value":1.2666},{"feature":"mcc_code","value":-1.0457},{"feature":"g_fanin_24h","value":0.998},{"feature":"g_passthrough_score","value":0.9877}],"evasion_hypothesis":null},{"instance_id":"I000333","vector_id":"V013","chain":["open_mule_account","drain_single","layer_through_mules","cross_channel_hop"],"primitives_present":["open_mule_account","drain_single","layer_through_mules","cross_channel_hop"],"score":0.001034,"level_scores":{"transaction":null,"session":null,"graph":null},"top_shap":[{"feature":"g_fanout_24h","value":1.9915},{"feature":"g_passthrough_score","value":-1.9869},{"feature":"channel_code","value":1.9532},{"feature":"mcc_code","value":1.7693},{"feature":"acct_txn_count_24h","value":1.4159},{"feature":"g_degree_ratio","value":1.3118}],"evasion_hypothesis":null},{"instance_id":"I000302","vector_id":"V002","chain":["open_mule_account","drain_single","layer_through_mules","cross_channel_hop"],"primitives_present":["open_mule_account","drain_single","layer_through_mules","cross_channel_hop"],"score":0.000457,"level_scores":{"transaction":null,"session":null,"graph":null},"top_shap":[{"feature":"mcc_code","value":2.2366},{"feature":"g_fanin_24h","value":1.7836},{"feature":"channel_code","value":1.3787},{"feature":"dev_decline_ratio_1h","value":1.3192},{"feature":"hour_of_day","value":0.8102},{"feature":"account_age_days","value":-0.7122}],"evasion_hypothesis":null}],"per_vector":[{"vector_id":"V001","n_instances":2,"n_detected":2,"detection_rate":1.0,"holdout":"none"},{"vector_id":"V002","n_instances":4,"n_detected":3,"detection_rate":0.75,"holdout":"none"},{"vector_id":"V003","n_instances":1,"n_detected":1,"detection_rate":1.0,"holdout":"none"},{"vector_id":"V005","n_instances":2,"n_detected":2,"detection_rate":1.0,"holdout":"none"},{"vector_id":"V009","n_instances":3,"n_detected":3,"detection_rate":1.0,"holdout":"none"},{"vector_id":"V010","n_instances":3,"n_detected":3,"detection_rate":1.0,"holdout":"none"},{"vector_id":"V012","n_instances":3,"n_detected":3,"detection_rate":1.0,"holdout":"none"},{"vector_id":"V013","n_instances":6,"n_detected":4,"detection_rate":0.6667,"holdout":"none"},{"vector_id":"V014","n_instances":9,"n_detected":9,"detection_rate":1.0,"holdout":"none"},{"vector_id":"V015","n_instances":7,"n_detected":7,"detection_rate":1.0,"holdout":"none"},{"vector_id":"V016","n_instances":7,"n_detected":7,"detection_rate":1.0,"holdout":"none"},{"vector_id":"V017","n_instances":5,"n_detected":5,"detection_rate":1.0,"holdout":"none"},{"vector_id":"V018","n_instances":2,"n_detected":2,"detection_rate":1.0,"holdout":"none"},{"vector_id":"V019","n_instances":8,"n_detected":8,"detection_rate":1.0,"holdout":"none"},{"vector_id":"V020","n_instances":5,"n_detected":5,"detection_rate":1.0,"holdout":"none"},{"vector_id":"V004","n_instances":1,"n_detected":1,"detection_rate":1.0,"holdout":"family"},{"vector_id":"V007","n_instances":4,"n_detected":4,"detection_rate":1.0,"holdout":"family"}]}
