{"contract_version":"0.1.0","run_id":"adl-g3-20260831","generation":3,"threshold":0.01305,"prevalence":0.008234,"misses":[{"instance_id":"I000483","vector_id":"V003","chain":["add_beneficiary","micro_test","drain_single"],"primitives_present":["add_beneficiary","micro_test","drain_single"],"score":0.004818,"level_scores":{"transaction":null,"session":null,"graph":null},"top_shap":[{"feature":"mcc_code","value":4.3489},{"feature":"amount_inr","value":3.2653},{"feature":"channel_code","value":0.9782},{"feature":"sess_n_events","value":0.8004},{"feature":"log_amount","value":0.5744},{"feature":"dev_txn_count_1h","value":-0.3362}],"evasion_hypothesis":null},{"instance_id":"I000137","vector_id":"V017","chain":["open_mule_account","drain_single","layer_through_mules","cross_channel_hop"],"primitives_present":["open_mule_account","drain_single","layer_through_mules","cross_channel_hop"],"score":0.000231,"level_scores":{"transaction":null,"session":null,"graph":null},"top_shap":[{"feature":"mcc_code","value":2.0938},{"feature":"acct_txn_count_24h","value":-1.9899},{"feature":"dev_txn_count_1h","value":1.6548},{"feature":"channel_code","value":1.2778},{"feature":"g_residence_seconds","value":0.809},{"feature":"hour_of_day","value":0.7774}],"evasion_hypothesis":null}],"per_vector":[{"vector_id":"V002","n_instances":8,"n_detected":8,"detection_rate":1.0,"holdout":"none"},{"vector_id":"V003","n_instances":2,"n_detected":1,"detection_rate":0.5,"holdout":"none"},{"vector_id":"V005","n_instances":1,"n_detected":1,"detection_rate":1.0,"holdout":"none"},{"vector_id":"V009","n_instances":2,"n_detected":2,"detection_rate":1.0,"holdout":"none"},{"vector_id":"V010","n_instances":3,"n_detected":3,"detection_rate":1.0,"holdout":"none"},{"vector_id":"V011","n_instances":4,"n_detected":4,"detection_rate":1.0,"holdout":"none"},{"vector_id":"V012","n_instances":8,"n_detected":8,"detection_rate":1.0,"holdout":"none"},{"vector_id":"V013","n_instances":2,"n_detected":2,"detection_rate":1.0,"holdout":"none"},{"vector_id":"V015","n_instances":2,"n_detected":2,"detection_rate":1.0,"holdout":"none"},{"vector_id":"V017","n_instances":7,"n_detected":6,"detection_rate":0.8571,"holdout":"none"},{"vector_id":"V018","n_instances":5,"n_detected":5,"detection_rate":1.0,"holdout":"none"},{"vector_id":"V019","n_instances":1,"n_detected":1,"detection_rate":1.0,"holdout":"none"},{"vector_id":"V020","n_instances":3,"n_detected":3,"detection_rate":1.0,"holdout":"none"},{"vector_id":"V021","n_instances":1,"n_detected":1,"detection_rate":1.0,"holdout":"none"},{"vector_id":"V024","n_instances":7,"n_detected":7,"detection_rate":1.0,"holdout":"none"},{"vector_id":"V026","n_instances":3,"n_detected":3,"detection_rate":1.0,"holdout":"none"},{"vector_id":"V004","n_instances":2,"n_detected":2,"detection_rate":1.0,"holdout":"family"},{"vector_id":"V006","n_instances":2,"n_detected":2,"detection_rate":1.0,"holdout":"family"}]}
