{"contract_version":"0.1.0","run_id":"adl-g0-20260831","generation":0,"threshold":0.025797,"prevalence":0.008438,"misses":[{"instance_id":"I004474","vector_id":"V002","chain":["open_mule_account","drain_single","layer_through_mules","cross_channel_hop"],"primitives_present":["open_mule_account","drain_single","layer_through_mules","cross_channel_hop"],"score":0.0003,"level_scores":{"transaction":null,"session":null,"graph":null},"top_shap":[{"feature":"mcc_code","value":2.3987},{"feature":"channel_code","value":1.4288},{"feature":"auth_declined","value":0.9118},{"feature":"g_fanin_24h","value":0.8024},{"feature":"g_degree_ratio","value":0.6409},{"feature":"g_residence_seconds","value":0.6287}],"evasion_hypothesis":null}],"per_vector":[{"vector_id":"V001","n_instances":57,"n_detected":57,"detection_rate":1.0,"holdout":"none"},{"vector_id":"V002","n_instances":120,"n_detected":119,"detection_rate":0.9917,"holdout":"none"},{"vector_id":"V003","n_instances":51,"n_detected":51,"detection_rate":1.0,"holdout":"none"},{"vector_id":"V005","n_instances":13,"n_detected":13,"detection_rate":1.0,"holdout":"none"},{"vector_id":"V004","n_instances":27,"n_detected":27,"detection_rate":1.0,"holdout":"family"},{"vector_id":"V006","n_instances":21,"n_detected":7,"detection_rate":0.3333,"holdout":"family"},{"vector_id":"V007","n_instances":35,"n_detected":35,"detection_rate":1.0,"holdout":"family"},{"vector_id":"V008","n_instances":23,"n_detected":23,"detection_rate":1.0,"holdout":"composition"}]}
