{"contract_version":"0.1.0","run_id":"adl-g1-20260831","generation":1,"threshold":0.017315,"prevalence":0.005716,"misses":[{"instance_id":"I000881","vector_id":"V013","chain":["open_mule_account","drain_single","layer_through_mules","cross_channel_hop"],"primitives_present":["open_mule_account","drain_single","layer_through_mules","cross_channel_hop"],"score":0.004562,"level_scores":{"transaction":null,"session":null,"graph":null},"top_shap":[{"feature":"g_fanout_24h","value":3.3419},{"feature":"g_residence_seconds","value":1.878},{"feature":"g_passthrough_score","value":-1.7209},{"feature":"dev_txn_count_1h","value":1.1945},{"feature":"channel_code","value":1.1236},{"feature":"acct_txn_count_24h","value":0.9054}],"evasion_hypothesis":null},{"instance_id":"I000489","vector_id":"V013","chain":["open_mule_account","drain_single","layer_through_mules","cross_channel_hop"],"primitives_present":["open_mule_account","drain_single","layer_through_mules","cross_channel_hop"],"score":0.010292,"level_scores":{"transaction":null,"session":null,"graph":null},"top_shap":[{"feature":"amount_z_account","value":2.5881},{"feature":"mcc_code","value":2.4349},{"feature":"g_fanin_24h","value":1.3974},{"feature":"auth_declined","value":1.3165},{"feature":"g_fanout_24h","value":-1.2404},{"feature":"channel_code","value":1.2339}],"evasion_hypothesis":null}],"per_vector":[{"vector_id":"V001","n_instances":1,"n_detected":1,"detection_rate":1.0,"holdout":"none"},{"vector_id":"V002","n_instances":10,"n_detected":10,"detection_rate":1.0,"holdout":"none"},{"vector_id":"V003","n_instances":3,"n_detected":3,"detection_rate":1.0,"holdout":"none"},{"vector_id":"V005","n_instances":1,"n_detected":1,"detection_rate":1.0,"holdout":"none"},{"vector_id":"V009","n_instances":3,"n_detected":3,"detection_rate":1.0,"holdout":"none"},{"vector_id":"V010","n_instances":6,"n_detected":6,"detection_rate":1.0,"holdout":"none"},{"vector_id":"V011","n_instances":3,"n_detected":3,"detection_rate":1.0,"holdout":"none"},{"vector_id":"V012","n_instances":3,"n_detected":3,"detection_rate":1.0,"holdout":"none"},{"vector_id":"V013","n_instances":12,"n_detected":10,"detection_rate":0.8333,"holdout":"none"},{"vector_id":"V014","n_instances":13,"n_detected":13,"detection_rate":1.0,"holdout":"none"},{"vector_id":"V004","n_instances":3,"n_detected":3,"detection_rate":1.0,"holdout":"family"},{"vector_id":"V006","n_instances":3,"n_detected":3,"detection_rate":1.0,"holdout":"family"},{"vector_id":"V007","n_instances":3,"n_detected":3,"detection_rate":1.0,"holdout":"family"}]}
