{"contract_version":"0.1.0","run_id":"adl-g4-20260831","generation":4,"threshold":0.011967,"prevalence":0.011293,"misses":[{"instance_id":"I000519","vector_id":"V009","chain":["synthesise_identity","open_mule_account","merchant_collusion_payout"],"primitives_present":["synthesise_identity","open_mule_account","merchant_collusion_payout"],"score":0.007235,"level_scores":{"transaction":null,"session":null,"graph":null},"top_shap":[{"feature":"channel_code","value":5.1725},{"feature":"mcc_code","value":-2.103},{"feature":"g_fanout_24h","value":1.9703},{"feature":"g_degree_ratio","value":1.9286},{"feature":"g_passthrough_score","value":-1.2745},{"feature":"g_shared_device_degree","value":1.2505}],"evasion_hypothesis":null}],"per_vector":[{"vector_id":"V001","n_instances":2,"n_detected":2,"detection_rate":1.0,"holdout":"none"},{"vector_id":"V002","n_instances":5,"n_detected":5,"detection_rate":1.0,"holdout":"none"},{"vector_id":"V003","n_instances":3,"n_detected":3,"detection_rate":1.0,"holdout":"none"},{"vector_id":"V009","n_instances":2,"n_detected":1,"detection_rate":0.5,"holdout":"none"},{"vector_id":"V010","n_instances":1,"n_detected":1,"detection_rate":1.0,"holdout":"none"},{"vector_id":"V011","n_instances":9,"n_detected":9,"detection_rate":1.0,"holdout":"none"},{"vector_id":"V012","n_instances":3,"n_detected":3,"detection_rate":1.0,"holdout":"none"},{"vector_id":"V015","n_instances":2,"n_detected":2,"detection_rate":1.0,"holdout":"none"},{"vector_id":"V016","n_instances":1,"n_detected":1,"detection_rate":1.0,"holdout":"none"},{"vector_id":"V017","n_instances":6,"n_detected":6,"detection_rate":1.0,"holdout":"none"},{"vector_id":"V018","n_instances":5,"n_detected":5,"detection_rate":1.0,"holdout":"none"},{"vector_id":"V019","n_instances":3,"n_detected":3,"detection_rate":1.0,"holdout":"none"},{"vector_id":"V020","n_instances":2,"n_detected":2,"detection_rate":1.0,"holdout":"none"},{"vector_id":"V021","n_instances":1,"n_detected":1,"detection_rate":1.0,"holdout":"none"},{"vector_id":"V022","n_instances":3,"n_detected":3,"detection_rate":1.0,"holdout":"none"},{"vector_id":"V024","n_instances":3,"n_detected":3,"detection_rate":1.0,"holdout":"none"},{"vector_id":"V026","n_instances":1,"n_detected":1,"detection_rate":1.0,"holdout":"none"},{"vector_id":"V027","n_instances":4,"n_detected":4,"detection_rate":1.0,"holdout":"none"},{"vector_id":"V028","n_instances":3,"n_detected":3,"detection_rate":1.0,"holdout":"none"},{"vector_id":"V029","n_instances":7,"n_detected":7,"detection_rate":1.0,"holdout":"none"},{"vector_id":"V030","n_instances":2,"n_detected":2,"detection_rate":1.0,"holdout":"none"},{"vector_id":"V031","n_instances":3,"n_detected":3,"detection_rate":1.0,"holdout":"none"},{"vector_id":"V032","n_instances":2,"n_detected":2,"detection_rate":1.0,"holdout":"none"},{"vector_id":"V006","n_instances":3,"n_detected":2,"detection_rate":0.6667,"holdout":"family"},{"vector_id":"V007","n_instances":1,"n_detected":1,"detection_rate":1.0,"holdout":"family"}]}
